subject,topic,stem,option_a,option_b,option_c,option_d,option_e,correct_label,difficulty,source_ref,year
باطنية,داء السكري النوع الثاني,مريض عمره 55 سنة، BMI=32، A1C=8.9%، ما هو الخيار الأنسب كخطوة أولى بعد تعديل نمط الحياة؟,إضافة ميتفورمين,البدء بالأنسولين القاعدي فورًا,سلفونيل يوريا فقط,لا حاجة لأي دواء حاليًا,مثبط DPP-4 كخيار وحيد,A,med,ADA Standards of Care 2024,2024
باطنية,قصور القلب مع كسر قذفي منخفض,مريض مع HFrEF (EF 30%) مستقر، أي الأدوية التالية جزء أساسي من العلاج القاعدي؟,حاصر بيتا ومثبط ACE/ARNI ومضاد مستقبلات ألدوستيرون,مدرّ بول حلقي فقط,ديجوكسين فقط,محصرات قنوات الكالسيوم غير ديهيدروبيريدين كخيار أول,لا علاج مثبت الفعالية,A,med,ACC/AHA/HFSA 2022-2024,2023
باطنية,فقر الدم بعوز الحديد,مريضة شابة لديها Ferritin=8 ng/mL، ما الخطوة المفضلة للعلاج الأولي؟,حديد فموي جرعات مجزأة,فيتامين B12 فموي,حمض الفوليك فقط,نقل دم فوري دون أعراض,لا حاجة لعلاج,A,easy,WHO guidelines,2020
باطنية,الربو,مريض ربو متقطع متوسط الشدة، ما العلاج المبدئي الموصى به؟,SABA بمفرده عند الحاجة فقط,ICS جرعة منخفضة بحسب الحاجة مع فورموتيرول,مضاد هيستامين فموي يومي,كورتيزون فموي يومي جرعة منخفضة,مضاد حيوي واسع الطيف,B,med,GINA 2024,2024
باطنية,فرط ضغط الدم,مريض 48 سنة ضغطه 152/94 دون أمراض مرافقه، ما الخيار الدوائي المبدئي المناسب؟,مثبط ACE أو ARB أو ثيازايد أو حاصر قنوات الكالسيوم,حاصر بيتا للجميع كخيار أول,أملوديبين + محصر قنوات كالسيوم آخر مباشرة,لا علاج دوائي مطلقًا,كورتيزون فموي,A,easy,ESH/ESC 2023,2023
